<?xml version="1.0" encoding="UTF-8"?>
<blueprint xmlns="http://www.osgi.org/xmlns/blueprint/v1.0.0"
    xmlns:xsi="http://www.w3.org/2001/XMLSchema-instance"
    xsi:schemaLocation="http://www.osgi.org/xmlns/blueprint/v1.0.0 http://www.osgi.org/xmlns/blueprint/v1.0.0/blueprint.xsd">

    <description>
        This is a checker for different sorting combinations.
    </description>

    <!-- This is the same, but using a comparator that sorts on ServiceReferences -->
    <bean id="ServiceReferenceComparatorChecker" class="org.osgi.test.cases.blueprint.components.serviceimport.ReferenceCollectionSortChecker" init-method="init">
        <argument value="ServiceReferenceComparatorChecker"/>
        <property name="serviceManager">
            <reference interface="org.osgi.test.cases.blueprint.services.ServiceManager"/>
        </property>
        <property name="bundleContext" ref="bundleContext"/>
        <property name="useReferences" value="true"/>
        <property name="list">
            <ref-list interface="org.osgi.test.cases.blueprint.services.TestServiceOne" ordering-basis="service-reference" member-type="service-reference">
                <comparator>
                    <bean class="org.osgi.test.cases.blueprint.components.serviceimport.ServiceReferenceComparator"/>
                </comparator>
            </ref-list>
        </property>
        <property name="sortOrder">
            <list>
                <value>ServiceOneA</value>
                <value>ServiceOneB</value>
                <value>ServiceOneC</value>
                <value>ServiceOneD</value>
                <value>TestServiceF</value>
            </list>
        </property>
    </bean>
</blueprint>

